{
  "$schema": "http://json-schema.org/draft-07/schema#",
  "type": "object",
  "properties": {
    "id": { "type": "string" },
    "timestamp": { "type": "string", "format": "date-time" },
    "type": { "type": "string" },
    "intention": { "type": "string" },
    "status": { "type": "string", "enum": ["ACTIVE", "INCOMPLETE", "COMPLETED", "ARCHIVED"] },
    "artifacts": {
      "type": "array",
      "items": {
        "type": "object",
        "properties": {
          "path": { "type": "string" },
          "type": { "type": "string" },
          "timestamp": { "type": "string", "format": "date-time" },
          "metadata": { "type": "object" }
        },
        "required": ["path", "type", "timestamp"]
      }
    },
    "assessments": {
      "type": "array",
      "items": { "type": "string" }
    },
    "open_questions": {
      "type": "array",
      "items": { "type": "string" }
    },
    "roadmap": {
      "type": "array",
      "items": { "type": "string" }
    }
  },
  "required": ["id", "timestamp", "type", "intention", "status"]
}
